{
  "schemaVersion": "viadecide.node-schema.v1",
  "roadmap": {
    "id": "reclaim-algorithmic-control",
    "version": "1.0.0",
    "title": "Reclaim Algorithmic Control",
    "track": "Mental Autonomy",
    "promise": "Make the manipulation pattern visible, choose the matching intervention, and verify whether control improves.",
    "statusVocabulary": ["locked", "available", "active", "completed", "verified"]
  },
  "stateStreams": ["knowledge", "personal", "decision", "action", "evidence", "risk", "resource", "conversation"],
  "sources": [
    { "id": "SRC-001", "title": "Social Media and Youth Mental Health: The U.S. Surgeon General's Advisory", "publisher": "U.S. Department of Health and Human Services", "url": "https://www.hhs.gov/sites/default/files/sg-youth-mental-health-social-media-advisory.pdf", "classification": "authoritative-guidance", "note": "Evidence is strongest for youth; the roadmap must not generalize every risk estimate to all adults." },
    { "id": "SRC-002", "title": "Health advisory on social media use in adolescence", "publisher": "American Psychological Association", "url": "https://www.apa.org/topics/social-media-internet/health-advisory-adolescent-social-media-use", "classification": "authoritative-guidance", "note": "Supports media literacy, monitoring, sleep protection, and developmentally appropriate boundaries." },
    { "id": "SRC-003", "title": "Digital Services Act, Regulation (EU) 2022/2065", "publisher": "European Union", "url": "https://eur-lex.europa.eu/eli/reg/2022/2065/oj/eng", "classification": "regulation", "note": "Provides authoritative definitions and obligations around recommender-system transparency and systemic risk." },
    { "id": "SRC-004", "title": "The Predictive Utility of Reward-Based Motives Underlying Excessive and Problematic Social Networking Sites Use", "publisher": "International Journal of Environmental Research and Public Health", "url": "https://pmc.ncbi.nlm.nih.gov/articles/PMC9483697/", "classification": "primary-research", "note": "Examines social-reward motives; it does not establish that all frequent use is addiction." },
    { "id": "SRC-005", "title": "Problematic Social Networking Site use-effects on mental health and the brain", "publisher": "Frontiers in Psychiatry", "url": "https://pmc.ncbi.nlm.nih.gov/articles/PMC9893026/", "classification": "primary-research", "note": "Review emphasizing associations, uncertainty, and the need for more causal research." },
    { "id": "SRC-006", "title": "Potential risks of content, features, and functions", "publisher": "American Psychological Association", "url": "https://www.apa.org/topics/social-media-internet/youth-social-media-2024", "classification": "authoritative-guidance", "note": "Supports literacy and feature-level risk assessment for younger users." },
    { "id": "SRC-NF-001", "title": "Recognize the Signs", "publisher": "Neural Friction", "url": "https://www.instagram.com/neural.friction/", "classification": "creator-original", "note": "Acquisition visual and node summary; not treated as independent evidence." }
  ],
  "resources": [
    { "id": "RES-001", "title": "Recognize the Signs carousel", "access": "free", "classification": "protocol", "relevance": "Turns the opening signal into a fast self-observation prompt.", "applicableStates": ["available", "active"], "expectedOutcome": "User can name one observed feed pattern.", "affiliate": false, "sourceId": "SRC-NF-001" },
    { "id": "RES-002", "title": "Surgeon General advisory", "access": "open", "classification": "evidence", "relevance": "Provides benefits, risks, uncertainty, and protective actions.", "applicableStates": ["active", "completed"], "expectedOutcome": "User separates evidence from broad anti-platform claims.", "affiliate": false, "sourceId": "SRC-001" },
    { "id": "RES-003", "title": "Seven-day control log", "access": "free", "classification": "template", "relevance": "Records baseline, intervention, triggers, and outcome without requiring an app integration.", "applicableStates": ["active", "completed"], "expectedOutcome": "A comparable baseline and follow-up record exists.", "affiliate": false },
    { "id": "RES-004", "title": "Attention Boundary workbook", "access": "paid", "classification": "protocol", "relevance": "Adds implementation templates and relapse planning after the branch is selected.", "applicableStates": ["completed", "verified"], "expectedOutcome": "The chosen boundary becomes repeatable across seven days.", "affiliate": false },
    { "id": "RES-005", "title": "Professional support directory", "access": "open", "classification": "specialist", "relevance": "Routes users beyond self-guided scope when distress, safety, or loss of function is disclosed.", "applicableStates": ["active"], "expectedOutcome": "User acknowledges and can access an appropriate human support route.", "affiliate": false }
  ],
  "nodes": [
    {
      "id": "NF-ALG-001", "type": "SIGNAL", "title": "Recognize the Signs", "purpose": "Determine whether a recommendation loop is currently reducing deliberate choice.", "track": "Mental Autonomy", "estimatedMinutes": 2, "prerequisites": [],
      "surface": { "summary": "Notice repetition, automatic checking, emotional hooks, and loss of deliberate stopping.", "primaryAction": "Name one observed sign" },
      "depth": { "overview": "Start from observed behaviour, not a diagnosis or a claim about platform intent.", "mechanism": "Recommendation systems optimize selected engagement objectives, while user outcomes vary by person, content, and context.", "evidence": ["SRC-001", "SRC-003", "SRC-005"], "decide": ["Does at least one sign affect a valued activity?"], "act": ["Record one recent example and what it displaced."], "constraints": ["Frequent use alone does not establish addiction or harm."] },
      "branches": [{ "id": "BR-001-CONTINUE", "condition": "observed_sign_exists", "nextNodeId": "NF-ALG-002", "records": { "signal_present": true } }, { "id": "BR-001-EXIT", "condition": "no_material_sign", "nextNodeId": "NF-ALG-014", "records": { "signal_present": false } }],
      "resources": { "open": ["RES-002"], "free": ["RES-001"], "paid": [] },
      "completion": { "requires": ["observed_sign", "displaced_activity"], "produces": ["signal_present", "observed_trigger"], "verification": "recorded-answer" },
      "chatContext": { "allowedScope": ["observed signs", "examples", "roadmap fit"], "mustUseState": ["observed_trigger"], "permittedNextNodes": ["NF-ALG-002", "NF-ALG-014"], "forbidden": ["diagnose addiction", "infer platform intent"] }
    },
    {
      "id": "NF-ALG-002", "type": "DIAGNOSTIC", "title": "Capture the Decision State", "purpose": "Capture problem, outcome, constraint, readiness, and risk before selecting a branch.", "track": "Mental Autonomy", "estimatedMinutes": 4, "prerequisites": ["NF-ALG-001"],
      "surface": { "summary": "Define what is happening, what must change, what limits action, readiness, and downside risk.", "primaryAction": "Answer five state questions" },
      "depth": { "overview": "The same behaviour can require different actions when the desired outcome or risk differs.", "mechanism": "Explicit constraints prevent the roadmap from recommending an intervention the user cannot sustain.", "evidence": ["SRC-001", "SRC-002", "SRC-006"], "decide": ["Is this self-guided scope safe?", "Is the user here to understand, decide, or act?"], "act": ["Record one answer for each intent dimension."], "constraints": ["High distress, danger, harassment, or material loss of function triggers escalation."] },
      "branches": [{ "id": "BR-002-STANDARD", "condition": "risk_self_guided", "nextNodeId": "NF-ALG-003", "records": { "risk_route": "self_guided" } }, { "id": "BR-002-ESCALATE", "condition": "risk_requires_human_support", "nextNodeId": "NF-ALG-010", "records": { "risk_route": "escalation" } }],
      "resources": { "open": ["RES-002", "RES-005"], "free": ["RES-003"], "paid": [] },
      "completion": { "requires": ["problem", "desired_outcome", "constraint", "readiness", "risk"], "produces": ["intent_state", "risk_route"], "verification": "recorded-answer" },
      "chatContext": { "allowedScope": ["five intent dimensions", "constraints", "risk routing"], "mustUseState": ["problem", "desired_outcome", "constraint", "readiness", "risk"], "permittedNextNodes": ["NF-ALG-003", "NF-ALG-010"], "forbidden": ["override escalation condition", "silently fill missing answers"] }
    },
    {
      "id": "NF-ALG-003", "type": "CONTEXT", "title": "Understand the Loop", "purpose": "Separate recommender mechanics, social reward, and user vulnerability without collapsing them into one cause.", "track": "Mental Autonomy", "estimatedMinutes": 5, "prerequisites": ["NF-ALG-002"],
      "surface": { "summary": "See how ranking, feedback, repetition, and context can reinforce automatic behaviour.", "primaryAction": "Confirm the mechanism distinction" },
      "depth": { "overview": "A recommender system selects and ranks content; the experienced effect depends on feedback, motives, content, and context.", "mechanism": "Personalization can narrow exposure, social reward can reinforce checking, and emotionally salient content can interrupt deliberate control.", "evidence": ["SRC-003", "SRC-004", "SRC-005"], "decide": ["Which mechanism best explains the recorded example?"], "act": ["Map trigger → platform response → user response → consequence."], "constraints": ["Do not claim a single universal manipulation mechanism."] },
      "branches": [{ "id": "BR-003-NEXT", "condition": "mechanism_map_recorded", "nextNodeId": "NF-ALG-004", "records": { "knowledge_loop_model": true } }],
      "resources": { "open": ["RES-002"], "free": ["RES-003"], "paid": [] },
      "completion": { "requires": ["mechanism_map"], "produces": ["knowledge_loop_model", "candidate_mechanism"], "verification": "recorded-answer" },